miopen/gfx1030_11.HIP.2_17_0_a82233c22-dirty.ufdb.txt
1-3-3-3x3-1-1-1-1-0x0-1x1-1x1-0-NCHW-FP16-F=miopenConvolutionFwdAlgoDirect:ConvDirectNaiveConvFwd,0.01488,0,miopenConvolutionFwdAlgoDirect,<unused>;miopenConvolutionFwdAlgoWinograd:ConvBinWinogradRxSf2x3g1,0.06496,0,miopenConvolutionFwdAlgoWinograd,<unused>;miopenConvolutionFwdAlgoGEMM:GemmFwdRest,0.03272,18,miopenConvolutionFwdAlgoGEMM,<unused>
4-64-64-3x3-320-64-64-2-1x1-1x1-1x1-0-NCHW-FP16-F=miopenConvolutionFwdAlgoDirect:ConvDirectNaiveConvFwd,2.78734,0,miopenConvolutionFwdAlgoDirect,<unused>;miopenConvolutionFwdAlgoWinograd:ConvBinWinogradRxSf2x3g1,0.08596,0,miopenConvolutionFwdAlgoWinograd,<unused>;miopenConvolutionFwdAlgoGEMM:GemmFwdRest,0.09944,294912,miopenConvolutionFwdAlgoGEMM,<unused>
320-64-64-3x3-320-64-64-2-1x1-1x1-1x1-0-NCHW-FP16-F=miopenConvolutionFwdAlgoImplicitGEMM:ConvCkIgemmFwdV6r1DlopsNchw,4.32619,4096,miopenConvolutionFwdAlgoImplicitGEMM,<unused>;miopenConvolutionFwdAlgoDirect:ConvDirectNaiveConvFwd,216.989,0,miopenConvolutionFwdAlgoDirect,<unused>;miopenConvolutionFwdAlgoWinograd:ConvBinWinogradRxSf2x3g1,0.986207,0,miopenConvolutionFwdAlgoWinograd,<unused>;miopenConvolutionFwdAlgoGEMM:GemmFwdRest,2.93322,23592960,miopenConvolutionFwdAlgoGEMM,<unused>
320-64-64-1x1-320-64-64-2-0x0-1x1-1x1-0-NCHW-FP16-F=miopenConvolutionFwdAlgoImplicitGEMM:ConvCkIgemmFwdV6r1DlopsNchw,0.620125,4096,miopenConvolutionFwdAlgoImplicitGEMM,<unused>;miopenConvolutionFwdAlgoDirect:ConvDirectNaiveConvFwd,31.4742,0,miopenConvolutionFwdAlgoDirect,<unused>;miopenConvolutionFwdAlgoWinograd:ConvBinWinogradRxSf3x2,0.518723,0,miopenConvolutionFwdAlgoWinograd,<unused>;miopenConvolutionFwdAlgoGEMM:GemmFwd1x1_0_1,0.284482,0,miopenConvolutionFwdAlgoGEMM,<unused>
320-64-64-3x3-320-32-32-2-1x1-2x2-1x1-0-NCHW-FP16-F=miopenConvolutionFwdAlgoImplicitGEMM:ConvCkIgemmFwdV6r1DlopsNchw,1.48901,4096,miopenConvolutionFwdAlgoImplicitGEMM,<unused>;miopenConvolutionFwdAlgoDirect:ConvDirectNaiveConvFwd,54.7208,0,miopenConvolutionFwdAlgoDirect,<unused>;miopenConvolutionFwdAlgoWinograd:ConvBinWinogradRxSf2x3g1,1.06393,0,miopenConvolutionFwdAlgoWinograd,<unused>;miopenConvolutionFwdAlgoGEMM:GemmFwdRest,1.22091,5898240,miopenConvolutionFwdAlgoGEMM,<unused>
320-32-32-3x3-640-32-32-2-1x1-1x1-1x1-0-NCHW-FP16-F=miopenConvolutionFwdAlgoImplicitGEMM:ConvCkIgemmFwdV6r1DlopsNchw,1.39193,4096,miopenConvolutionFwdAlgoImplicitGEMM,<unused>;miopenConvolutionFwdAlgoDirect:ConvDirectNaiveConvFwd,106.799,0,miopenConvolutionFwdAlgoDirect,<unused>;miopenConvolutionFwdAlgoWinograd:ConvBinWinogradRxSf2x3g1,0.508523,0,miopenConvolutionFwdAlgoWinograd,<unused>;miopenConvolutionFwdAlgoGEMM:GemmFwdRest,1.33581,5898240,miopenConvolutionFwdAlgoGEMM,<unused>
640-32-32-3x3-640-32-32-2-1x1-1x1-1x1-0-NCHW-FP16-F=miopenConvolutionFwdAlgoImplicitGEMM:ConvCkIgemmFwdV6r1DlopsNchw,2.74514,4096,miopenConvolutionFwdAlgoImplicitGEMM,<unused>;miopenConvolutionFwdAlgoDirect:ConvDirectNaiveConvFwd,214.023,0,miopenConvolutionFwdAlgoDirect,<unused>;miopenConvolutionFwdAlgoWinograd:ConvBinWinogradRxSf2x3g1,0.963406,0,miopenConvolutionFwdAlgoWinograd,<unused>;miopenConvolutionFwdAlgoGEMM:GemmFwdRest,3.00282,11796480,miopenConvolutionFwdAlgoGEMM,<unused>
320-32-32-1x1-640-32-32-2-0x0-1x1-1x1-0-NCHW-FP16-F=miopenConvolutionFwdAlgoImplicitGEMM:ConvCkIgemmFwdV6r1DlopsNchw,0.184081,4096,miopenConvolutionFwdAlgoImplicitGEMM,<unused>;miopenConvolutionFwdAlgoDirect:ConvDirectNaiveConvFwd,15.363,0,miopenConvolutionFwdAlgoDirect,<unused>;miopenConvolutionFwdAlgoWinograd:ConvBinWinogradRxSf3x2,0.294002,0,miopenConvolutionFwdAlgoWinograd,<unused>;miopenConvolutionFwdAlgoGEMM:GemmFwd1x1_0_1,0.134201,0,miopenConvolutionFwdAlgoGEMM,<unused>
640-32-32-1x1-640-32-32-2-0x0-1x1-1x1-0-NCHW-FP16-F=miopenConvolutionFwdAlgoImplicitGEMM:ConvCkIgemmFwdV6r1DlopsNchw,0.334722,4096,miopenConvolutionFwdAlgoImplicitGEMM,<unused>;miopenConvolutionFwdAlgoDirect:ConvDirectNaiveConvFwd,30.7321,0,miopenConvolutionFwdAlgoDirect,<unused>;miopenConvolutionFwdAlgoWinograd:ConvBinWinogradRxSf3x2,0.523643,0,miopenConvolutionFwdAlgoWinograd,<unused>;miopenConvolutionFwdAlgoGEMM:GemmFwd1x1_0_1,0.253322,0,miopenConvolutionFwdAlgoGEMM,<unused>
640-32-32-3x3-640-16-16-2-1x1-2x2-1x1-0-NCHW-FP16-F=miopenConvolutionFwdAlgoImplicitGEMM:ConvCkIgemmFwdV6r1DlopsNchw,0.802605,4096,miopenConvolutionFwdAlgoImplicitGEMM,<unused>;miopenConvolutionFwdAlgoDirect:ConvDirectNaiveConvFwd,53.5373,0,miopenConvolutionFwdAlgoDirect,<unused>;miopenConvolutionFwdAlgoWinograd:ConvBinWinogradRxSf2x3g1,1.05641,0,miopenConvolutionFwdAlgoWinograd,<unused>;miopenConvolutionFwdAlgoGEMM:GemmFwdRest,1.40185,2949120,miopenConvolutionFwdAlgoGEMM,<unused>
640-16-16-3x3-1280-16-16-2-1x1-1x1-1x1-0-NCHW-FP16-F=miopenConvolutionFwdAlgoImplicitGEMM:ConvCkIgemmFwdV6r1DlopsNchw,1.45501,4096,miopenConvolutionFwdAlgoImplicitGEMM,<unused>;miopenConvolutionFwdAlgoDirect:ConvDirectNaiveConvFwd,106.476,0,miopenConvolutionFwdAlgoDirect,<unused>;miopenConvolutionFwdAlgoWinograd:ConvBinWinogradRxSf2x3g1,0.526363,0,miopenConvolutionFwdAlgoWinograd,<unused>;miopenConvolutionFwdAlgoGEMM:GemmFwdRest,2.77394,2949120,miopenConvolutionFwdAlgoGEMM,<unused>
1280-16-16-3x3-1280-16-16-2-1x1-1x1-1x1-0-NCHW-FP16-F=miopenConvolutionFwdAlgoImplicitGEMM:ConvCkIgemmFwdV6r1DlopsNchw,2.8875,4096,miopenConvolutionFwdAlgoImplicitGEMM,<unused>;miopenConvolutionFwdAlgoDirect:ConvDirectNaiveConvFwd,212.175,0,miopenConvolutionFwdAlgoDirect,<unused>;miopenConvolutionFwdAlgoWinograd:ConvBinWinogradRxSf2x3g1,1.01369,0,miopenConvolutionFwdAlgoWinograd,<unused>;miopenConvolutionFwdAlgoGEMM:GemmFwdRest,2.93402,5898240,miopenConvolutionFwdAlgoGEMM,<unused>
640-16-16-1x1-1280-16-16-2-0x0-1x1-1x1-0-NCHW-FP16-F=miopenConvolutionFwdAlgoImplicitGEMM:ConvCkIgemmFwdV6r1DlopsNchw,0.189001,4096,miopenConvolutionFwdAlgoImplicitGEMM,<unused>;miopenConvolutionFwdAlgoDirect:ConvDirectNaiveConvFwd,15.2035,0,miopenConvolutionFwdAlgoDirect,<unused>;miopenConvolutionFwdAlgoWinograd:ConvBinWinogradRxSf3x2,0.402283,0,miopenConvolutionFwdAlgoWinograd,<unused>;miopenConvolutionFwdAlgoGEMM:GemmFwd1x1_0_1,0.125041,0,miopenConvolutionFwdAlgoGEMM,<unused>
1280-16-16-1x1-1280-16-16-2-0x0-1x1-1x1-0-NCHW-FP16-F=miopenConvolutionFwdAlgoImplicitGEMM:ConvCkIgemmFwdV6r1DlopsNchw,0.348722,4096,miopenConvolutionFwdAlgoImplicitGEMM,<unused>;miopenConvolutionFwdAlgoDirect:ConvDirectNaiveConvFwd,30.3669,0,miopenConvolutionFwdAlgoDirect,<unused>;miopenConvolutionFwdAlgoWinograd:ConvBinWinogradRxSf3x2,0.749164,0,miopenConvolutionFwdAlgoWinograd,<unused>;miopenConvolutionFwdAlgoGEMM:GemmFwd1x1_0_1,0.252761,0,miopenConvolutionFwdAlgoGEMM,<unused>
1280-16-16-3x3-1280-8-8-2-1x1-2x2-1x1-0-NCHW-FP16-F=miopenConvolutionFwdAlgoImplicitGEMM:ConvCkIgemmFwdV6r1DlopsNchw,1.10765,4096,miopenConvolutionFwdAlgoImplicitGEMM,<unused>;miopenConvolutionFwdAlgoDirect:ConvDirectNaiveConvFwd,106.222,0,miopenConvolutionFwdAlgoDirect,<unused>;miopenConvolutionFwdAlgoWinograd:ConvBinWinogradRxSf2x3g1,1.05561,0,miopenConvolutionFwdAlgoWinograd,<unused>;miopenConvolutionFwdAlgoGEMM:GemmFwdRest,3.044,1474560,miopenConvolutionFwdAlgoGEMM,<unused>
1280-8-8-3x3-1280-8-8-2-1x1-1x1-1x1-0-NCHW-FP16-F=miopenConvolutionFwdAlgoImplicitGEMM:ConvCkIgemmFwdV6r1DlopsNchw,1.04365,4096,miopenConvolutionFwdAlgoImplicitGEMM,<unused>;miopenConvolutionFwdAlgoDirect:ConvDirectNaiveConvFwd,106.153,0,miopenConvolutionFwdAlgoDirect,<unused>;miopenConvolutionFwdAlgoWinograd:ConvBinWinogradRxSf2x3g1,0.279162,0,miopenConvolutionFwdAlgoWinograd,<unused>;miopenConvolutionFwdAlgoGEMM:GemmFwdRest,2.4741,1474560,miopenConvolutionFwdAlgoGEMM,<unused>
1280-8-8-1x1-1280-8-8-2-0x0-1x1-1x1-0-NCHW-FP16-F=miopenConvolutionFwdAlgoImplicitGEMM:ConvCkIgemmFwdV6r1DlopsNchw,0.154161,4096,miopenConvolutionFwdAlgoImplicitGEMM,<unused>;miopenConvolutionFwdAlgoDirect:ConvDirectNaiveConvFwd,15.1977,0,miopenConvolutionFwdAlgoDirect,<unused>;miopenConvolutionFwdAlgoWinograd:ConvBinWinogradRxSf3x2,0.272201,0,miopenConvolutionFwdAlgoWinograd,<unused>;miopenConvolutionFwdAlgoGEMM:GemmFwd1x1_0_1,0.14412,0,miopenConvolutionFwdAlgoGEMM,<unused>
2560-8-8-3x3-1280-8-8-2-1x1-1x1-1x1-0-NCHW-FP16-F=miopenConvolutionFwdAlgoImplicitGEMM:ConvCkIgemmFwdV6r1DlopsNchw,2.19905,4096,miopenConvolutionFwdAlgoImplicitGEMM,<unused>;miopenConvolutionFwdAlgoDirect:ConvDirectNaiveConvFwd,212.341,0,miopenConvolutionFwdAlgoDirect,<unused>;miopenConvolutionFwdAlgoWinograd:ConvBinWinogradRxSf2x3g1,0.530523,0,miopenConvolutionFwdAlgoWinograd,<unused>;miopenConvolutionFwdAlgoGEMM:GemmFwdRest,6.48204,2949120,miopenConvolutionFwdAlgoGEMM,<unused>
2560-8-8-1x1-1280-8-8-2-0x0-1x1-1x1-0-NCHW-FP16-F=miopenConvolutionFwdAlgoImplicitGEMM:ConvCkIgemmFwdV6r1DlopsNchw,0.307922,4096,miopenConvolutionFwdAlgoImplicitGEMM,<unused>;miopenConvolutionFwdAlgoDirect:ConvDirectNaiveConvFwd,30.3874,0,miopenConvolutionFwdAlgoDirect,<unused>;miopenConvolutionFwdAlgoWinograd:ConvBinWinogradRxSf3x2,0.507683,0,miopenConvolutionFwdAlgoWinograd,<unused>;miopenConvolutionFwdAlgoGEMM:GemmFwd1x1_0_1,0.279402,0,miopenConvolutionFwdAlgoGEMM,<unused>
2560-16-16-3x3-1280-16-16-2-1x1-1x1-1x1-0-NCHW-FP16-F=miopenConvolutionFwdAlgoImplicitGEMM:ConvCkIgemmFwdV6r1DlopsNchw,5.82904,4096,miopenConvolutionFwdAlgoImplicitGEMM,<unused>;miopenConvolutionFwdAlgoDirect:ConvDirectNaiveConvFwd,424.473,0,miopenConvolutionFwdAlgoDirect,<unused>;miopenConvolutionFwdAlgoWinograd:ConvBinWinogradRxSf2x3g1,1.99285,0,miopenConvolutionFwdAlgoWinograd,<unused>;miopenConvolutionFwdAlgoGEMM:GemmFwdRest,6.84092,11796480,miopenConvolutionFwdAlgoGEMM,<unused>
2560-16-16-1x1-1280-16-16-2-0x0-1x1-1x1-0-NCHW-FP16-F=miopenConvolutionFwdAlgoImplicitGEMM:ConvCkIgemmFwdV6r1DlopsNchw,0.678484,4096,miopenConvolutionFwdAlgoImplicitGEMM,<unused>;miopenConvolutionFwdAlgoDirect:ConvDirectNaiveConvFwd,60.8046,0,miopenConvolutionFwdAlgoDirect,<unused>;miopenConvolutionFwdAlgoWinograd:ConvBinWinogradRxSf3x2,1.44773,0,miopenConvolutionFwdAlgoWinograd,<unused>;miopenConvolutionFwdAlgoGEMM:GemmFwd1x1_0_1,0.534083,0,miopenConvolutionFwdAlgoGEMM,<unused>
1920-16-16-3x3-1280-16-16-2-1x1-1x1-1x1-0-NCHW-FP16-F=miopenConvolutionFwdAlgoImplicitGEMM:ConvCkIgemmFwdV6r1DlopsNchw,4.30407,4096,miopenConvolutionFwdAlgoImplicitGEMM,<unused>;miopenConvolutionFwdAlgoDirect:ConvDirectNaiveConvFwd,318.211,0,miopenConvolutionFwdAlgoDirect,<unused>;miopenConvolutionFwdAlgoWinograd:ConvBinWinogradRxSf2x3g1,1.49877,0,miopenConvolutionFwdAlgoWinograd,<unused>;miopenConvolutionFwdAlgoGEMM:GemmFwdRest,4.01826,8847360,miopenConvolutionFwdAlgoGEMM,<unused>
1920-16-16-1x1-1280-16-16-2-0x0-1x1-1x1-0-NCHW-FP16-F=miopenConvolutionFwdAlgoImplicitGEMM:ConvCkIgemmFwdV6r1DlopsNchw,0.506444,4096,miopenConvolutionFwdAlgoImplicitGEMM,<unused>;miopenConvolutionFwdAlgoDirect:ConvDirectNaiveConvFwd,45.7305,0,miopenConvolutionFwdAlgoDirect,<unused>;miopenConvolutionFwdAlgoWinograd:ConvBinWinogradRxSf3x2,1.09625,0,miopenConvolutionFwdAlgoWinograd,<unused>;miopenConvolutionFwdAlgoGEMM:GemmFwd1x1_0_1,0.745205,0,miopenConvolutionFwdAlgoGEMM,<unused>
1280-32-32-3x3-1280-32-32-2-1x1-1x1-1x1-0-NCHW-FP16-F=miopenConvolutionFwdAlgoImplicitGEMM:ConvCkIgemmFwdV6r1DlopsNchw,10.0151,4096,miopenConvolutionFwdAlgoImplicitGEMM,<unused>;miopenConvolutionFwdAlgoDirect:ConvDirectNaiveConvFwd,849.753,0,miopenConvolutionFwdAlgoDirect,<unused>;miopenConvolutionFwdAlgoWinograd:ConvBinWinogradRxSf2x3g1,3.72126,0,miopenConvolutionFwdAlgoWinograd,<unused>;miopenConvolutionFwdAlgoGEMM:GemmFwdRest,11.9211,23592960,miopenConvolutionFwdAlgoGEMM,<unused>
1920-32-32-3x3-640-32-32-2-1x1-1x1-1x1-0-NCHW-FP16-F=miopenConvolutionFwdAlgoImplicitGEMM:ConvCkIgemmFwdV6r1DlopsNchw,8.17513,4096,miopenConvolutionFwdAlgoImplicitGEMM,<unused>;miopenConvolutionFwdAlgoDirect:ConvDirectNaiveConvFwd,643.366,0,miopenConvolutionFwdAlgoDirect,<unused>;miopenConvolutionFwdAlgoWinograd:ConvBinWinogradRxSf2x3g1,2.78958,0,miopenConvolutionFwdAlgoWinograd,<unused>;miopenConvolutionFwdAlgoGEMM:GemmFwdRest,6.61132,35389440,miopenConvolutionFwdAlgoGEMM,<unused>
1920-32-32-1x1-640-32-32-2-0x0-1x1-1x1-0-NCHW-FP16-F=miopenConvolutionFwdAlgoImplicitGEMM:ConvCkIgemmFwdV6r1DlopsNchw,0.940446,4096,miopenConvolutionFwdAlgoImplicitGEMM,<unused>;miopenConvolutionFwdAlgoDirect:ConvDirectNaiveConvFwd,92.6766,0,miopenConvolutionFwdAlgoDirect,<unused>;miopenConvolutionFwdAlgoWinograd:ConvBinWinogradRxSf3x2,1.45221,0,miopenConvolutionFwdAlgoWinograd,<unused>;miopenConvolutionFwdAlgoGEMM:GemmFwd1x1_0_1,0.726765,0,miopenConvolutionFwdAlgoGEMM,<unused>
1280-32-32-3x3-640-32-32-2-1x1-1x1-1x1-0-NCHW-FP16-F=miopenConvolutionFwdAlgoImplicitGEMM:ConvCkIgemmFwdV6r1DlopsNchw,5.47707,4096,miopenConvolutionFwdAlgoImplicitGEMM,<unused>;miopenConvolutionFwdAlgoDirect:ConvDirectNaiveConvFwd,428.663,0,miopenConvolutionFwdAlgoDirect,<unused>;miopenConvolutionFwdAlgoWinograd:ConvBinWinogradRxSf2x3g1,1.87961,0,miopenConvolutionFwdAlgoWinograd,<unused>;miopenConvolutionFwdAlgoGEMM:GemmFwdRest,5.95948,23592960,miopenConvolutionFwdAlgoGEMM,<unused>
1280-32-32-1x1-640-32-32-2-0x0-1x1-1x1-0-NCHW-FP16-F=miopenConvolutionFwdAlgoImplicitGEMM:ConvCkIgemmFwdV6r1DlopsNchw,0.638404,4096,miopenConvolutionFwdAlgoImplicitGEMM,<unused>;miopenConvolutionFwdAlgoDirect:ConvDirectNaiveConvFwd,61.7731,0,miopenConvolutionFwdAlgoDirect,<unused>;miopenConvolutionFwdAlgoWinograd:ConvBinWinogradRxSf3x2,0.992927,0,miopenConvolutionFwdAlgoWinograd,<unused>;miopenConvolutionFwdAlgoGEMM:GemmFwd1x1_0_1,0.496643,0,miopenConvolutionFwdAlgoGEMM,<unused>
960-32-32-3x3-640-32-32-2-1x1-1x1-1x1-0-NCHW-FP16-F=miopenConvolutionFwdAlgoImplicitGEMM:ConvCkIgemmFwdV6r1DlopsNchw,4.10031,4096,miopenConvolutionFwdAlgoImplicitGEMM,<unused>;miopenConvolutionFwdAlgoDirect:ConvDirectNaiveConvFwd,321.276,0,miopenConvolutionFwdAlgoDirect,<unused>;miopenConvolutionFwdAlgoWinograd:ConvBinWinogradRxSf2x3g1,1.44537,0,miopenConvolutionFwdAlgoWinograd,<unused>;miopenConvolutionFwdAlgoGEMM:GemmFwdRest,4.47331,17694720,miopenConvolutionFwdAlgoGEMM,<unused>
960-32-32-1x1-640-32-32-2-0x0-1x1-1x1-0-NCHW-FP16-F=miopenConvolutionFwdAlgoImplicitGEMM:ConvCkIgemmFwdV6r1DlopsNchw,0.487043,4096,miopenConvolutionFwdAlgoImplicitGEMM,<unused>;miopenConvolutionFwdAlgoDirect:ConvDirectNaiveConvFwd,46.2229,0,miopenConvolutionFwdAlgoDirect,<unused>;miopenConvolutionFwdAlgoWinograd:ConvBinWinogradRxSf3x2,0.757045,0,miopenConvolutionFwdAlgoWinograd,<unused>;miopenConvolutionFwdAlgoGEMM:GemmFwd1x1_0_1,0.378563,0,miopenConvolutionFwdAlgoGEMM,<unused>
640-64-64-3x3-640-64-64-2-1x1-1x1-1x1-0-NCHW-FP16-F=miopenConvolutionFwdAlgoImplicitGEMM:ConvCkIgemmFwdV6r1DlopsNchw,9.88662,4096,miopenConvolutionFwdAlgoImplicitGEMM,<unused>;miopenConvolutionFwdAlgoDirect:ConvDirectNaiveConvFwd,859.967,0,miopenConvolutionFwdAlgoDirect,<unused>;miopenConvolutionFwdAlgoWinograd:ConvBinWinogradRxSf2x3g1,3.71702,0,miopenConvolutionFwdAlgoWinograd,<unused>;miopenConvolutionFwdAlgoGEMM:GemmFwdRest,8.90709,47185920,miopenConvolutionFwdAlgoGEMM,<unused>
960-64-64-3x3-320-64-64-2-1x1-1x1-1x1-0-NCHW-FP16-F=miopenConvolutionFwdAlgoImplicitGEMM:ConvCkIgemmFwdV6r1DlopsNchw,13.2515,4096,miopenConvolutionFwdAlgoImplicitGEMM,<unused>;miopenConvolutionFwdAlgoDirect:ConvDirectNaiveConvFwd,655.288,0,miopenConvolutionFwdAlgoDirect,<unused>;miopenConvolutionFwdAlgoWinograd:ConvBinWinogradRxSf2x3g1,2.81165,0,miopenConvolutionFwdAlgoWinograd,<unused>;miopenConvolutionFwdAlgoGEMM:GemmFwdRest,9.46182,70778880,miopenConvolutionFwdAlgoGEMM,<unused>
960-64-64-1x1-320-64-64-2-0x0-1x1-1x1-0-NCHW-FP16-F=miopenConvolutionFwdAlgoImplicitGEMM:ConvCkIgemmFwdV6r1DlopsNchw,1.81973,4096,miopenConvolutionFwdAlgoImplicitGEMM,<unused>;miopenConvolutionFwdAlgoDirect:ConvDirectNaiveConvFwd,95.1455,0,miopenConvolutionFwdAlgoDirect,<unused>;miopenConvolutionFwdAlgoWinograd:ConvBinWinogradRxSf3x2,1.38913,0,miopenConvolutionFwdAlgoWinograd,<unused>;miopenConvolutionFwdAlgoGEMM:GemmFwd1x1_0_1,0.936285,0,miopenConvolutionFwdAlgoGEMM,<unused>
640-64-64-3x3-320-64-64-2-1x1-1x1-1x1-0-NCHW-FP16-F=miopenConvolutionFwdAlgoImplicitGEMM:ConvCkIgemmFwdV6r1DlopsNchw,8.77841,4096,miopenConvolutionFwdAlgoImplicitGEMM,<unused>;miopenConvolutionFwdAlgoDirect:ConvDirectNaiveConvFwd,435.957,0,miopenConvolutionFwdAlgoDirect,<unused>;miopenConvolutionFwdAlgoWinograd:ConvBinWinogradRxSf2x3g1,1.90041,0,miopenConvolutionFwdAlgoWinograd,<unused>;miopenConvolutionFwdAlgoGEMM:GemmFwdRest,5.68315,47185920,miopenConvolutionFwdAlgoGEMM,<unused>
640-64-64-1x1-320-64-64-2-0x0-1x1-1x1-0-NCHW-FP16-F=miopenConvolutionFwdAlgoImplicitGEMM:ConvCkIgemmFwdV6r1DlopsNchw,1.21681,4096,miopenConvolutionFwdAlgoImplicitGEMM,<unused>;miopenConvolutionFwdAlgoDirect:ConvDirectNaiveConvFwd,63.2125,0,miopenConvolutionFwdAlgoDirect,<unused>;miopenConvolutionFwdAlgoWinograd:ConvBinWinogradRxSf3x2,1.39897,0,miopenConvolutionFwdAlgoWinograd,<unused>;miopenConvolutionFwdAlgoGEMM:GemmFwd1x1_0_1,0.637364,0,miopenConvolutionFwdAlgoGEMM,<unused>
320-64-64-3x3-4-64-64-2-1x1-1x1-1x1-0-NCHW-FP16-F=miopenConvolutionFwdAlgoDirect:ConvDirectNaiveConvFwd,10.3948,0,miopenConvolutionFwdAlgoDirect,<unused>;miopenConvolutionFwdAlgoWinograd:ConvBinWinogradRxSf2x3g1,0.122121,0,miopenConvolutionFwdAlgoWinograd,<unused>;miopenConvolutionFwdAlgoGEMM:GemmFwdRest,0.866564,23592960,miopenConvolutionFwdAlgoGEMM,<unused>
4-150-150-7x7-8-144-144-1-0x0-1x1-1x1-0-NCHW-FP16-F=miopenConvolutionFwdAlgoDirect:ConvDirectNaiveConvFwd,2.47706,0,miopenConvolutionFwdAlgoDirect,<unused>;miopenConvolutionFwdAlgoWinograd:ConvBinWinogradRxSf3x2,0.08456,0,miopenConvolutionFwdAlgoWinograd,<unused>;miopenConvolutionFwdAlgoGEMM:GemmFwdRest,0.180921,8128512,miopenConvolutionFwdAlgoGEMM,<unused>
8-144-144-5x5-16-140-140-1-0x0-1x1-1x1-0-NCHW-FP16-F=miopenConvolutionFwdAlgoDirect:ConvDirectNaiveConvFwd,3.18654,0,miopenConvolutionFwdAlgoDirect,<unused>;miopenConvolutionFwdAlgoWinograd:ConvBinWinogradRxSf2x3g1,0.06348,0,miopenConvolutionFwdAlgoWinograd,<unused>;miopenConvolutionFwdAlgoGEMM:GemmFwdRest,0.16468,7840000,miopenConvolutionFwdAlgoGEMM,<unused>
16-140-140-3x3-32-138-138-1-0x0-1x1-1x1-0-NCHW-FP16-F=miopenConvolutionFwdAlgoDirect:ConvDirectNaiveConvFwd,3.4455,0,miopenConvolutionFwdAlgoDirect,<unused>;miopenConvolutionFwdAlgoWinograd:ConvBinWinogradRxSf2x3g1,0.05032,0,miopenConvolutionFwdAlgoWinograd,<unused>;miopenConvolutionFwdAlgoGEMM:GemmFwdRest,0.168321,5484672,miopenConvolutionFwdAlgoGEMM,<unused>
32-138-138-3x3-64-136-136-1-0x0-1x1-1x1-0-NCHW-FP16-F=miopenConvolutionFwdAlgoDirect:ConvDirectNaiveConvFwd,11.4435,0,miopenConvolutionFwdAlgoDirect,<unused>;miopenConvolutionFwdAlgoWinograd:ConvBinWinogradRxSf2x3g1,0.09384,0,miopenConvolutionFwdAlgoWinograd,<unused>;miopenConvolutionFwdAlgoGEMM:GemmFwdRest,0.296801,10653696,miopenConvolutionFwdAlgoGEMM,<unused>
64-136-136-3x3-32-134-134-1-0x0-1x1-1x1-0-NCHW-FP16-F=miopenConvolutionFwdAlgoDirect:ConvDirectNaiveConvFwd,13.4186,0,miopenConvolutionFwdAlgoDirect,<unused>;miopenConvolutionFwdAlgoWinograd:ConvBinWinogradRxSf2x3g1,0.08248,0,miopenConvolutionFwdAlgoWinograd,<unused>;miopenConvolutionFwdAlgoGEMM:GemmFwdRest,0.530963,20685312,miopenConvolutionFwdAlgoGEMM,<unused>
32-134-134-3x3-16-132-132-1-0x0-1x1-1x1-0-NCHW-FP16-F=miopenConvolutionFwdAlgoDirect:ConvDirectNaiveConvFwd,4.56055,0,miopenConvolutionFwdAlgoDirect,<unused>;miopenConvolutionFwdAlgoWinograd:ConvBinWinogradRxSf2x3g1,0.06016,0,miopenConvolutionFwdAlgoWinograd,<unused>;miopenConvolutionFwdAlgoGEMM:GemmFwdRest,0.280562,10036224,miopenConvolutionFwdAlgoGEMM,<unused>
16-132-132-3x3-8-130-130-1-0x0-1x1-1x1-0-NCHW-FP16-F=miopenConvolutionFwdAlgoDirect:ConvDirectNaiveConvFwd,1.89297,0,miopenConvolutionFwdAlgoDirect,<unused>;miopenConvolutionFwdAlgoWinograd:ConvBinWinogradRxSf2x3g1,0.04996,0,miopenConvolutionFwdAlgoWinograd,<unused>;miopenConvolutionFwdAlgoGEMM:GemmFwdRest,0.1572,4867200,miopenConvolutionFwdAlgoGEMM,<unused>
8-130-130-3x3-3-128-128-1-0x0-1x1-1x1-0-NCHW-FP16-F=miopenConvolutionFwdAlgoDirect:ConvDirectNaiveConvFwd,0.917526,0,miopenConvolutionFwdAlgoDirect,<unused>;miopenConvolutionFwdAlgoWinograd:ConvBinWinogradRxSf2x3g1,0.04224,0,miopenConvolutionFwdAlgoWinograd,<unused>;miopenConvolutionFwdAlgoGEMM:GemmFwdRest,0.09304,2359296,miopenConvolutionFwdAlgoGEMM,<unused>
1-3-3-3x3-1-1-1-1-0x0-1x1-1x1-0-NCHW-FP32-F=miopenConvolutionFwdAlgoDirect:ConvDirectNaiveConvFwd,0.0098,0,miopenConvolutionFwdAlgoDirect,<unused>;miopenConvolutionFwdAlgoWinograd:ConvBinWinogradRxSf2x3g1,0.02584,0,miopenConvolutionFwdAlgoWinograd,<unused>;miopenConvolutionFwdAlgoGEMM:GemmFwdRest,0.02344,36,miopenConvolutionFwdAlgoGEMM,<unused>
4-64-64-3x3-320-64-64-2-1x1-1x1-1x1-0-NCHW-FP32-F=miopenConvolutionFwdAlgoDirect:ConvDirectNaiveConvFwd,2.77677,0,miopenConvolutionFwdAlgoDirect,<unused>;miopenConvolutionFwdAlgoWinograd:ConvBinWinogradRxSf2x3g1,0.087961,0,miopenConvolutionFwdAlgoWinograd,<unused>;miopenConvolutionFwdAlgoGEMM:GemmFwdRest,0.11608,589824,miopenConvolutionFwdAlgoGEMM,<unused>
320-64-64-3x3-320-64-64-2-1x1-1x1-1x1-0-NCHW-FP32-F=miopenConvolutionFwdAlgoImplicitGEMM:ConvCkIgemmFwdV6r1DlopsNchw,5.0795,4096,miopenConvolutionFwdAlgoImplicitGEMM,<unused>;miopenConvolutionFwdAlgoDirect:ConvDirectNaiveConvFwd,216.186,0,miopenConvolutionFwdAlgoDirect,<unused>;miopenConvolutionFwdAlgoWinograd:ConvBinWinogradRxSf2x3g1,1.66337,0,miopenConvolutionFwdAlgoWinograd,<unused>;miopenConvolutionFwdAlgoGEMM:GemmFwdRest,3.99226,47185920,miopenConvolutionFwdAlgoGEMM,<unused>
320-64-64-1x1-320-64-64-2-0x0-1x1-1x1-0-NCHW-FP32-F=miopenConvolutionFwdAlgoImplicitGEMM:ConvCkIgemmFwdV6r1DlopsNchw,0.592243,4096,miopenConvolutionFwdAlgoImplicitGEMM,<unused>;miopenConvolutionFwdAlgoDirect:ConvDirectNaiveConvFwd,31.6776,0,miopenConvolutionFwdAlgoDirect,<unused>;miopenConvolutionFwdAlgoWinograd:ConvBinWinogradRxSf3x2,0.856444,0,miopenConvolutionFwdAlgoWinograd,<unused>;miopenConvolutionFwdAlgoGEMM:GemmFwd1x1_0_1,0.385682,0,miopenConvolutionFwdAlgoGEMM,<unused>
320-64-64-3x3-320-32-32-2-1x1-2x2-1x1-0-NCHW-FP32-F=miopenConvolutionFwdAlgoImplicitGEMM:ConvCkIgemmFwdV6r1DlopsNchw,1.49453,4096,miopenConvolutionFwdAlgoImplicitGEMM,<unused>;miopenConvolutionFwdAlgoDirect:ConvDirectNaiveConvFwd,54.5646,0,miopenConvolutionFwdAlgoDirect,<unused>;miopenConvolutionFwdAlgoWinograd:ConvBinWinogradRxSf2x3g1,1.84449,0,miopenConvolutionFwdAlgoWinograd,<unused>;miopenConvolutionFwdAlgoGEMM:GemmFwdRest,1.58505,11796480,miopenConvolutionFwdAlgoGEMM,<unused>
320-32-32-3x3-640-32-32-2-1x1-1x1-1x1-0-NCHW-FP32-F=miopenConvolutionFwdAlgoImplicitGEMM:ConvCkIgemmFwdV6r1DlopsNchw,2.51197,4096,miopenConvolutionFwdAlgoImplicitGEMM,<unused>;miopenConvolutionFwdAlgoDirect:ConvDirectNaiveConvFwd,106.636,0,miopenConvolutionFwdAlgoDirect,<unused>;miopenConvolutionFwdAlgoWinograd:ConvBinWinogradRxSf2x3g1,0.851564,0,miopenConvolutionFwdAlgoWinograd,<unused>;miopenConvolutionFwdAlgoGEMM:GemmFwdRest,2.00089,11796480,miopenConvolutionFwdAlgoGEMM,<unused>
640-32-32-3x3-640-32-32-2-1x1-1x1-1x1-0-NCHW-FP32-F=miopenConvolutionFwdAlgoImplicitGEMM:ConvCkIgemmFwdV6r1DlopsNchw,5.33502,4096,miopenConvolutionFwdAlgoImplicitGEMM,<unused>;miopenConvolutionFwdAlgoDirect:ConvDirectNaiveConvFwd,213.65,0,miopenConvolutionFwdAlgoDirect,<unused>;miopenConvolutionFwdAlgoWinograd:ConvBinWinogradRxSf2x3g1,1.64449,0,miopenConvolutionFwdAlgoWinograd,<unused>;miopenConvolutionFwdAlgoGEMM:GemmFwdRest,5.45642,23592960,miopenConvolutionFwdAlgoGEMM,<unused>
320-32-32-1x1-640-32-32-2-0x0-1x1-1x1-0-NCHW-FP32-F=miopenConvolutionFwdAlgoImplicitGEMM:ConvCkIgemmFwdV6r1DlopsNchw,0.248441,4096,miopenConvolutionFwdAlgoImplicitGEMM,<unused>;miopenConvolutionFwdAlgoDirect:ConvDirectNaiveConvFwd,15.3548,0,miopenConvolutionFwdAlgoDirect,<unused>;miopenConvolutionFwdAlgoWinograd:ConvBinWinogradRxSf3x2,0.467282,0,miopenConvolutionFwdAlgoWinograd,<unused>;miopenConvolutionFwdAlgoGEMM:GemmFwd1x1_0_1,0.205721,0,miopenConvolutionFwdAlgoGEMM,<unused>
640-32-32-1x1-640-32-32-2-0x0-1x1-1x1-0-NCHW-FP32-F=miopenConvolutionFwdAlgoImplicitGEMM:ConvCkIgemmFwdV6r1DlopsNchw,0.469362,4096,miopenConvolutionFwdAlgoImplicitGEMM,<unused>;miopenConvolutionFwdAlgoDirect:ConvDirectNaiveConvFwd,30.7528,0,miopenConvolutionFwdAlgoDirect,<unused>;miopenConvolutionFwdAlgoWinograd:ConvBinWinogradRxSf3x2,0.877644,0,miopenConvolutionFwdAlgoWinograd,<unused>;miopenConvolutionFwdAlgoGEMM:GemmFwd1x1_0_1,0.394402,0,miopenConvolutionFwdAlgoGEMM,<unused>
640-32-32-3x3-640-16-16-2-1x1-2x2-1x1-0-NCHW-FP32-F=miopenConvolutionFwdAlgoImplicitGEMM:ConvCkIgemmFwdV6r1DlopsNchw,1.69673,4096,miopenConvolutionFwdAlgoImplicitGEMM,<unused>;miopenConvolutionFwdAlgoDirect:ConvDirectNaiveConvFwd,53.4647,0,miopenConvolutionFwdAlgoDirect,<unused>;miopenConvolutionFwdAlgoWinograd:ConvBinWinogradRxSf2x3g1,1.83881,0,miopenConvolutionFwdAlgoWinograd,<unused>;miopenConvolutionFwdAlgoGEMM:GemmFwdRest,2.10239,5898240,miopenConvolutionFwdAlgoGEMM,<unused>
640-16-16-3x3-1280-16-16-2-1x1-1x1-1x1-0-NCHW-FP32-F=miopenConvolutionFwdAlgoImplicitGEMM:ConvCkIgemmFwdV6r1DlopsNchw,2.81085,4096,miopenConvolutionFwdAlgoImplicitGEMM,<unused>;miopenConvolutionFwdAlgoDirect:ConvDirectNaiveConvFwd,106.41,0,miopenConvolutionFwdAlgoDirect,<unused>;miopenConvolutionFwdAlgoWinograd:ConvBinWinogradRxSf2x3g1,0.886404,0,miopenConvolutionFwdAlgoWinograd,<unused>;miopenConvolutionFwdAlgoGEMM:GemmFwdRest,4.07722,5898240,miopenConvolutionFwdAlgoGEMM,<unused>
1280-16-16-3x3-1280-16-16-2-1x1-1x1-1x1-0-NCHW-FP32-F=miopenConvolutionFwdAlgoImplicitGEMM:ConvCkIgemmFwdV6r1DlopsNchw,6.07367,4096,miopenConvolutionFwdAlgoImplicitGEMM,<unused>;miopenConvolutionFwdAlgoDirect:ConvDirectNaiveConvFwd,213.046,0,miopenConvolutionFwdAlgoDirect,<unused>;miopenConvolutionFwdAlgoWinograd:ConvBinWinogradRxSf2x3g1,1.76025,0,miopenConvolutionFwdAlgoWinograd,<unused>;miopenConvolutionFwdAlgoGEMM:GemmFwdRest,3.9465,11796480,miopenConvolutionFwdAlgoGEMM,<unused>
640-16-16-1x1-1280-16-16-2-0x0-1x1-1x1-0-NCHW-FP32-F=miopenConvolutionFwdAlgoImplicitGEMM:ConvCkIgemmFwdV6r1DlopsNchw,0.257081,4096,miopenConvolutionFwdAlgoImplicitGEMM,<unused>;miopenConvolutionFwdAlgoDirect:ConvDirectNaiveConvFwd,15.3417,0,miopenConvolutionFwdAlgoDirect,<unused>;miopenConvolutionFwdAlgoWinograd:ConvBinWinogradRxSf3x2,0.663842,0,miopenConvolutionFwdAlgoWinograd,<unused>;miopenConvolutionFwdAlgoGEMM:GemmFwd1x1_0_1,0.410321,0,miopenConvolutionFwdAlgoGEMM,<unused>
1280-16-16-1x1-1280-16-16-2-0x0-1x1-1x1-0-NCHW-FP32-F=miopenConvolutionFwdAlgoImplicitGEMM:ConvCkIgemmFwdV6r1DlopsNchw,0.485922,4096,miopenConvolutionFwdAlgoImplicitGEMM,<unused>;miopenConvolutionFwdAlgoDirect:ConvDirectNaiveConvFwd,30.4376,0,miopenConvolutionFwdAlgoDirect,<unused>;miopenConvolutionFwdAlgoWinograd:ConvBinWinogradRxSf3x2,1.29329,0,miopenConvolutionFwdAlgoWinograd,<unused>;miopenConvolutionFwdAlgoGEMM:GemmFwd1x1_0_1,0.599963,0,miopenConvolutionFwdAlgoGEMM,<unused>
1280-16-16-3x3-1280-8-8-2-1x1-2x2-1x1-0-NCHW-FP32-F=miopenConvolutionFwdAlgoImplicitGEMM:ConvCkIgemmFwdV6r1DlopsNchw,3.57389,4096,miopenConvolutionFwdAlgoImplicitGEMM,<unused>;miopenConvolutionFwdAlgoDirect:ConvDirectNaiveConvFwd,106.221,0,miopenConvolutionFwdAlgoDirect,<unused>;miopenConvolutionFwdAlgoWinograd:ConvBinWinogradRxSf2x3g1,1.84849,0,miopenConvolutionFwdAlgoWinograd,<unused>;miopenConvolutionFwdAlgoGEMM:GemmFwdRest,3.86258,2949120,miopenConvolutionFwdAlgoGEMM,<unused>
1280-8-8-3x3-1280-8-8-2-1x1-1x1-1x1-0-NCHW-FP32-F=miopenConvolutionFwdAlgoImplicitGEMM:ConvCkIgemmFwdV6r1DlopsNchw,3.09529,4096,miopenConvolutionFwdAlgoImplicitGEMM,<unused>;miopenConvolutionFwdAlgoDirect:ConvDirectNaiveConvFwd,105.814,0,miopenConvolutionFwdAlgoDirect,<unused>;miopenConvolutionFwdAlgoWinograd:ConvBinWinogradRxSf2x3g1,0.472682,0,miopenConvolutionFwdAlgoWinograd,<unused>;miopenConvolutionFwdAlgoGEMM:GemmFwdRest,3.80146,2949120,miopenConvolutionFwdAlgoGEMM,<unused>
1280-8-8-1x1-1280-8-8-2-0x0-1x1-1x1-0-NCHW-FP32-F=miopenConvolutionFwdAlgoImplicitGEMM:ConvCkIgemmFwdV6r1DlopsNchw,0.190561,4096,miopenConvolutionFwdAlgoImplicitGEMM,<unused>;miopenConvolutionFwdAlgoDirect:ConvDirectNaiveConvFwd,15.2144,0,miopenConvolutionFwdAlgoDirect,<unused>;miopenConvolutionFwdAlgoWinograd:ConvBinWinogradRxSf3x2,0.463842,0,miopenConvolutionFwdAlgoWinograd,<unused>;miopenConvolutionFwdAlgoGEMM:GemmFwd1x1_0_1,0.231601,0,miopenConvolutionFwdAlgoGEMM,<unused>
2560-8-8-3x3-1280-8-8-2-1x1-1x1-1x1-0-NCHW-FP32-F=miopenConvolutionFwdAlgoImplicitGEMM:ConvCkIgemmFwdV6r1DlopsNchw,7.70871,4096,miopenConvolutionFwdAlgoImplicitGEMM,<unused>;miopenConvolutionFwdAlgoDirect:ConvDirectNaiveConvFwd,211.792,0,miopenConvolutionFwdAlgoDirect,<unused>;miopenConvolutionFwdAlgoWinograd:ConvBinWinogradRxSf2x3g1,0.912644,0,miopenConvolutionFwdAlgoWinograd,<unused>;miopenConvolutionFwdAlgoGEMM:GemmFwdRest,7.54715,5898240,miopenConvolutionFwdAlgoGEMM,<unused>
2560-8-8-1x1-1280-8-8-2-0x0-1x1-1x1-0-NCHW-FP32-F=miopenConvolutionFwdAlgoImplicitGEMM:ConvCkIgemmFwdV6r1DlopsNchw,0.353362,4096,miopenConvolutionFwdAlgoImplicitGEMM,<unused>;miopenConvolutionFwdAlgoDirect:ConvDirectNaiveConvFwd,30.3746,0,miopenConvolutionFwdAlgoDirect,<unused>;miopenConvolutionFwdAlgoWinograd:ConvBinWinogradRxSf3x2,0.876884,0,miopenConvolutionFwdAlgoWinograd,<unused>;miopenConvolutionFwdAlgoGEMM:GemmFwd1x1_0_1,0.866604,0,miopenConvolutionFwdAlgoGEMM,<unused>
2560-16-16-3x3-1280-16-16-2-1x1-1x1-1x1-0-NCHW-FP32-F=miopenConvolutionFwdAlgoImplicitGEMM:ConvCkIgemmFwdV6r1DlopsNchw,13.633,4096,miopenConvolutionFwdAlgoImplicitGEMM,<unused>;miopenConvolutionFwdAlgoDirect:ConvDirectNaiveConvFwd,423.994,0,miopenConvolutionFwdAlgoDirect,<unused>;miopenConvolutionFwdAlgoWinograd:ConvBinWinogradRxSf2x3g1,3.45022,0,miopenConvolutionFwdAlgoWinograd,<unused>;miopenConvolutionFwdAlgoGEMM:GemmFwdRest,8.6522,23592960,miopenConvolutionFwdAlgoGEMM,<unused>
2560-16-16-1x1-1280-16-16-2-0x0-1x1-1x1-0-NCHW-FP32-F=miopenConvolutionFwdAlgoImplicitGEMM:ConvCkIgemmFwdV6r1DlopsNchw,0.949684,4096,miopenConvolutionFwdAlgoImplicitGEMM,<unused>;miopenConvolutionFwdAlgoDirect:ConvDirectNaiveConvFwd,60.7938,0,miopenConvolutionFwdAlgoDirect,<unused>;miopenConvolutionFwdAlgoWinograd:ConvBinWinogradRxSf3x2,2.54029,0,miopenConvolutionFwdAlgoWinograd,<unused>;miopenConvolutionFwdAlgoGEMM:GemmFwd1x1_0_1,3.53525,0,miopenConvolutionFwdAlgoGEMM,<unused>
1920-16-16-3x3-1280-16-16-2-1x1-1x1-1x1-0-NCHW-FP32-F=miopenConvolutionFwdAlgoImplicitGEMM:ConvCkIgemmFwdV6r1DlopsNchw,8.73128,4096,miopenConvolutionFwdAlgoImplicitGEMM,<unused>;miopenConvolutionFwdAlgoDirect:ConvDirectNaiveConvFwd,317.856,0,miopenConvolutionFwdAlgoDirect,<unused>;miopenConvolutionFwdAlgoWinograd:ConvBinWinogradRxSf2x3g1,2.58845,0,miopenConvolutionFwdAlgoWinograd,<unused>;miopenConvolutionFwdAlgoGEMM:GemmFwdRest,5.85418,17694720,miopenConvolutionFwdAlgoGEMM,<unused>
1920-16-16-1x1-1280-16-16-2-0x0-1x1-1x1-0-NCHW-FP32-F=miopenConvolutionFwdAlgoImplicitGEMM:ConvCkIgemmFwdV6r1DlopsNchw,0.715403,4096,miopenConvolutionFwdAlgoImplicitGEMM,<unused>;miopenConvolutionFwdAlgoDirect:ConvDirectNaiveConvFwd,45.4942,0,miopenConvolutionFwdAlgoDirect,<unused>;miopenConvolutionFwdAlgoWinograd:ConvBinWinogradRxSf3x2,1.89553,0,miopenConvolutionFwdAlgoWinograd,<unused>;miopenConvolutionFwdAlgoGEMM:GemmFwd1x1_0_1,1.19641,0,miopenConvolutionFwdAlgoGEMM,<unused>
1280-32-32-3x3-1280-32-32-2-1x1-1x1-1x1-0-NCHW-FP32-F=miopenConvolutionFwdAlgoImplicitGEMM:ConvCkIgemmFwdV6r1DlopsNchw,20.0568,4096,miopenConvolutionFwdAlgoImplicitGEMM,<unused>;miopenConvolutionFwdAlgoDirect:ConvDirectNaiveConvFwd,847.156,0,miopenConvolutionFwdAlgoDirect,<unused>;miopenConvolutionFwdAlgoWinograd:ConvBinWinogradRxSf2x3g1,6.44271,0,miopenConvolutionFwdAlgoWinograd,<unused>;miopenConvolutionFwdAlgoGEMM:GemmFwdRest,14.2613,47185920,miopenConvolutionFwdAlgoGEMM,<unused>
1920-32-32-3x3-640-32-32-2-1x1-1x1-1x1-0-NCHW-FP32-F=miopenConvolutionFwdAlgoImplicitGEMM:ConvCkIgemmFwdV6r1DlopsNchw,15.8915,4096,miopenConvolutionFwdAlgoImplicitGEMM,<unused>;miopenConvolutionFwdAlgoDirect:ConvDirectNaiveConvFwd,641.577,0,miopenConvolutionFwdAlgoDirect,<unused>;miopenConvolutionFwdAlgoWinograd:ConvBinWinogradRxSf2x3g1,4.83398,0,miopenConvolutionFwdAlgoWinograd,<unused>;miopenConvolutionFwdAlgoGEMM:GemmFwdRest,16.2768,70778880,miopenConvolutionFwdAlgoGEMM,<unused>
1920-32-32-1x1-640-32-32-2-0x0-1x1-1x1-0-NCHW-FP32-F=miopenConvolutionFwdAlgoImplicitGEMM:ConvCkIgemmFwdV6r1DlopsNchw,1.35417,4096,miopenConvolutionFwdAlgoImplicitGEMM,<unused>;miopenConvolutionFwdAlgoDirect:ConvDirectNaiveConvFwd,92.5749,0,miopenConvolutionFwdAlgoDirect,<unused>;miopenConvolutionFwdAlgoWinograd:ConvBinWinogradRxSf3x2,2.52945,0,miopenConvolutionFwdAlgoWinograd,<unused>;miopenConvolutionFwdAlgoGEMM:GemmFwd1x1_0_1,1.2312,0,miopenConvolutionFwdAlgoGEMM,<unused>
1280-32-32-3x3-640-32-32-2-1x1-1x1-1x1-0-NCHW-FP32-F=miopenConvolutionFwdAlgoImplicitGEMM:ConvCkIgemmFwdV6r1DlopsNchw,10.8024,4096,miopenConvolutionFwdAlgoImplicitGEMM,<unused>;miopenConvolutionFwdAlgoDirect:ConvDirectNaiveConvFwd,427.536,0,miopenConvolutionFwdAlgoDirect,<unused>;miopenConvolutionFwdAlgoWinograd:ConvBinWinogradRxSf2x3g1,3.25221,0,miopenConvolutionFwdAlgoWinograd,<unused>;miopenConvolutionFwdAlgoGEMM:GemmFwdRest,10.86,47185920,miopenConvolutionFwdAlgoGEMM,<unused>
1280-32-32-1x1-640-32-32-2-0x0-1x1-1x1-0-NCHW-FP32-F=miopenConvolutionFwdAlgoImplicitGEMM:ConvCkIgemmFwdV6r1DlopsNchw,0.909964,4096,miopenConvolutionFwdAlgoImplicitGEMM,<unused>;miopenConvolutionFwdAlgoDirect:ConvDirectNaiveConvFwd,61.7374,0,miopenConvolutionFwdAlgoDirect,<unused>;miopenConvolutionFwdAlgoWinograd:ConvBinWinogradRxSf3x2,1.70153,0,miopenConvolutionFwdAlgoWinograd,<unused>;miopenConvolutionFwdAlgoGEMM:GemmFwd1x1_0_1,0.771244,0,miopenConvolutionFwdAlgoGEMM,<unused>
960-32-32-3x3-640-32-32-2-1x1-1x1-1x1-0-NCHW-FP32-F=miopenConvolutionFwdAlgoImplicitGEMM:ConvCkIgemmFwdV6r1DlopsNchw,7.51715,4096,miopenConvolutionFwdAlgoImplicitGEMM,<unused>;miopenConvolutionFwdAlgoDirect:ConvDirectNaiveConvFwd,320.758,0,miopenConvolutionFwdAlgoDirect,<unused>;miopenConvolutionFwdAlgoWinograd:ConvBinWinogradRxSf2x3g1,2.43777,0,miopenConvolutionFwdAlgoWinograd,<unused>;miopenConvolutionFwdAlgoGEMM:GemmFwdRest,8.14899,35389440,miopenConvolutionFwdAlgoGEMM,<unused>
960-32-32-1x1-640-32-32-2-0x0-1x1-1x1-0-NCHW-FP32-F=miopenConvolutionFwdAlgoImplicitGEMM:ConvCkIgemmFwdV6r1DlopsNchw,0.691283,4096,miopenConvolutionFwdAlgoImplicitGEMM,<unused>;miopenConvolutionFwdAlgoDirect:ConvDirectNaiveConvFwd,46.2215,0,miopenConvolutionFwdAlgoDirect,<unused>;miopenConvolutionFwdAlgoWinograd:ConvBinWinogradRxSf3x2,1.28753,0,miopenConvolutionFwdAlgoWinograd,<unused>;miopenConvolutionFwdAlgoGEMM:GemmFwd1x1_0_1,0.578242,0,miopenConvolutionFwdAlgoGEMM,<unused>
640-64-64-3x3-640-64-64-2-1x1-1x1-1x1-0-NCHW-FP32-F=miopenConvolutionFwdAlgoImplicitGEMM:ConvCkIgemmFwdV6r1DlopsNchw,18.7967,4096,miopenConvolutionFwdAlgoImplicitGEMM,<unused>;miopenConvolutionFwdAlgoDirect:ConvDirectNaiveConvFwd,850.48,0,miopenConvolutionFwdAlgoDirect,<unused>;miopenConvolutionFwdAlgoWinograd:ConvBinWinogradRxSf2x3g1,6.96711,0,miopenConvolutionFwdAlgoWinograd,<unused>;miopenConvolutionFwdAlgoGEMM:GemmFwdRest,16.3687,94371840,miopenConvolutionFwdAlgoGEMM,<unused>
960-64-64-3x3-320-64-64-2-1x1-1x1-1x1-0-NCHW-FP32-F=miopenConvolutionFwdAlgoImplicitGEMM:ConvCkIgemmFwdV6r1DlopsNchw,15.1809,4096,miopenConvolutionFwdAlgoImplicitGEMM,<unused>;miopenConvolutionFwdAlgoDirect:ConvDirectNaiveConvFwd,652.197,0,miopenConvolutionFwdAlgoDirect,<unused>;miopenConvolutionFwdAlgoWinograd:ConvBinWinogradRxSf2x3g1,4.85162,0,miopenConvolutionFwdAlgoWinograd,<unused>;miopenConvolutionFwdAlgoGEMM:GemmFwdRest,16.9607,141557760,miopenConvolutionFwdAlgoGEMM,<unused>
960-64-64-1x1-320-64-64-2-0x0-1x1-1x1-0-NCHW-FP32-F=miopenConvolutionFwdAlgoImplicitGEMM:ConvCkIgemmFwdV6r1DlopsNchw,1.71469,4096,miopenConvolutionFwdAlgoImplicitGEMM,<unused>;miopenConvolutionFwdAlgoDirect:ConvDirectNaiveConvFwd,94.9808,0,miopenConvolutionFwdAlgoDirect,<unused>;miopenConvolutionFwdAlgoWinograd:ConvBinWinogradRxSf3x2,2.39477,0,miopenConvolutionFwdAlgoWinograd,<unused>;miopenConvolutionFwdAlgoGEMM:GemmFwd1x1_0_1,1.32497,0,miopenConvolutionFwdAlgoGEMM,<unused>
640-64-64-3x3-320-64-64-2-1x1-1x1-1x1-0-NCHW-FP32-F=miopenConvolutionFwdAlgoImplicitGEMM:ConvCkIgemmFwdV6r1DlopsNchw,10.132,4096,miopenConvolutionFwdAlgoImplicitGEMM,<unused>;miopenConvolutionFwdAlgoDirect:ConvDirectNaiveConvFwd,432.515,0,miopenConvolutionFwdAlgoDirect,<unused>;miopenConvolutionFwdAlgoWinograd:ConvBinWinogradRxSf2x3g1,3.25709,0,miopenConvolutionFwdAlgoWinograd,<unused>;miopenConvolutionFwdAlgoGEMM:GemmFwdRest,9.0942,94371840,miopenConvolutionFwdAlgoGEMM,<unused>
640-64-64-1x1-320-64-64-2-0x0-1x1-1x1-0-NCHW-FP32-F=miopenConvolutionFwdAlgoImplicitGEMM:ConvCkIgemmFwdV6r1DlopsNchw,1.15577,4096,miopenConvolutionFwdAlgoImplicitGEMM,<unused>;miopenConvolutionFwdAlgoDirect:ConvDirectNaiveConvFwd,63.3599,0,miopenConvolutionFwdAlgoDirect,<unused>;miopenConvolutionFwdAlgoWinograd:ConvBinWinogradRxSf3x2,1.88193,0,miopenConvolutionFwdAlgoWinograd,<unused>;miopenConvolutionFwdAlgoGEMM:GemmFwd1x1_0_1,0.905404,0,miopenConvolutionFwdAlgoGEMM,<unused>
320-64-64-3x3-4-64-64-2-1x1-1x1-1x1-0-NCHW-FP32-F=miopenConvolutionFwdAlgoDirect:ConvDirectNaiveConvFwd,9.66968,0,miopenConvolutionFwdAlgoDirect,<unused>;miopenConvolutionFwdAlgoWinograd:ConvBinWinogradRxSf2x3g1,0.185361,0,miopenConvolutionFwdAlgoWinograd,<unused>;miopenConvolutionFwdAlgoGEMM:GemmFwdRest,1.13376,47185920,miopenConvolutionFwdAlgoGEMM,<unused>
4-150-150-7x7-8-144-144-1-0x0-1x1-1x1-0-NCHW-FP32-F=miopenConvolutionFwdAlgoDirect:ConvDirectNaiveConvFwd,2.38125,0,miopenConvolutionFwdAlgoDirect,<unused>;miopenConvolutionFwdAlgoWinograd:ConvBinWinogradRxSf3x2,0.09664,0,miopenConvolutionFwdAlgoWinograd,<unused>;miopenConvolutionFwdAlgoGEMM:GemmFwdRest,0.234071,16257024,miopenConvolutionFwdAlgoGEMM,<unused>
8-144-144-5x5-16-140-140-1-0x0-1x1-1x1-0-NCHW-FP32-F=miopenConvolutionFwdAlgoDirect:ConvDirectNaiveConvFwd,2.98217,0,miopenConvolutionFwdAlgoDirect,<unused>;miopenConvolutionFwdAlgoWinograd:ConvBinWinogradRxSf2x3g1,0.0736,0,miopenConvolutionFwdAlgoWinograd,<unused>;miopenConvolutionFwdAlgoGEMM:GemmFwdRest,0.226361,15680000,miopenConvolutionFwdAlgoGEMM,<unused>
16-140-140-3x3-32-138-138-1-0x0-1x1-1x1-0-NCHW-FP32-F=miopenConvolutionFwdAlgoDirect:ConvDirectNaiveConvFwd,3.33101,0,miopenConvolutionFwdAlgoDirect,<unused>;miopenConvolutionFwdAlgoWinograd:ConvBinWinogradRxSf2x3g1,0.05288,0,miopenConvolutionFwdAlgoWinograd,<unused>;miopenConvolutionFwdAlgoGEMM:GemmFwdRest,0.16616,10969344,miopenConvolutionFwdAlgoGEMM,<unused>
32-138-138-3x3-64-136-136-1-0x0-1x1-1x1-0-NCHW-FP32-F=miopenConvolutionFwdAlgoDirect:ConvDirectNaiveConvFwd,11.4069,0,miopenConvolutionFwdAlgoDirect,<unused>;miopenConvolutionFwdAlgoWinograd:ConvBinWinogradRxSf2x3g1,0.119721,0,miopenConvolutionFwdAlgoWinograd,<unused>;miopenConvolutionFwdAlgoGEMM:GemmFwdRest,0.454641,21307392,miopenConvolutionFwdAlgoGEMM,<unused>
64-136-136-3x3-32-134-134-1-0x0-1x1-1x1-0-NCHW-FP32-F=miopenConvolutionFwdAlgoDirect:ConvDirectNaiveConvFwd,12.9096,0,miopenConvolutionFwdAlgoDirect,<unused>;miopenConvolutionFwdAlgoWinograd:ConvBinWinogradRxSf2x3g1,0.109841,0,miopenConvolutionFwdAlgoWinograd,<unused>;miopenConvolutionFwdAlgoGEMM:GemmFwdRest,0.838283,41370624,miopenConvolutionFwdAlgoGEMM,<unused>
32-134-134-3x3-16-132-132-1-0x0-1x1-1x1-0-NCHW-FP32-F=miopenConvolutionFwdAlgoDirect:ConvDirectNaiveConvFwd,4.43282,0,miopenConvolutionFwdAlgoDirect,<unused>;miopenConvolutionFwdAlgoWinograd:ConvBinWinogradRxSf2x3g1,0.07156,0,miopenConvolutionFwdAlgoWinograd,<unused>;miopenConvolutionFwdAlgoGEMM:GemmFwdRest,0.427921,20072448,miopenConvolutionFwdAlgoGEMM,<unused>
16-132-132-3x3-8-130-130-1-0x0-1x1-1x1-0-NCHW-FP32-F=miopenConvolutionFwdAlgoDirect:ConvDirectNaiveConvFwd,1.99809,0,miopenConvolutionFwdAlgoDirect,<unused>;miopenConvolutionFwdAlgoWinograd:ConvBinWinogradRxSf2x3g1,0.052401,0,miopenConvolutionFwdAlgoWinograd,<unused>;miopenConvolutionFwdAlgoGEMM:GemmFwdRest,0.220241,9734400,miopenConvolutionFwdAlgoGEMM,<unused>
8-130-130-3x3-3-128-128-1-0x0-1x1-1x1-0-NCHW-FP32-F=miopenConvolutionFwdAlgoDirect:ConvDirectNaiveConvFwd,0.974204,0,miopenConvolutionFwdAlgoDirect,<unused>;miopenConvolutionFwdAlgoWinograd:ConvBinWinogradRxSf2x3g1,0.039921,0,miopenConvolutionFwdAlgoWinograd,<unused>;miopenConvolutionFwdAlgoGEMM:GemmFwdRest,0.117961,4718592,miopenConvolutionFwdAlgoGEMM,<unused>
4-64-64-1x1-4-64-64-1-0x0-1x1-1x1-0-NCHW-FP32-F=miopenConvolutionFwdAlgoDirect:ConvDirectNaiveConvFwd,0.039241,0,miopenConvolutionFwdAlgoDirect,<unused>;miopenConvolutionFwdAlgoWinograd:ConvBinWinogradRxSf2x3g1,0.02684,0,miopenConvolutionFwdAlgoWinograd,<unused>;miopenConvolutionFwdAlgoGEMM:GemmFwd1x1_0_1,0.01584,0,miopenConvolutionFwdAlgoGEMM,<unused>
4-64-64-3x3-512-64-64-1-1x1-1x1-1x1-0-NCHW-FP32-F=miopenConvolutionFwdAlgoDirect:ConvDirectNaiveConvFwd,2.22137,0,miopenConvolutionFwdAlgoDirect,<unused>;miopenConvolutionFwdAlgoWinograd:ConvBinWinogradRxSf2x3g1,0.081001,0,miopenConvolutionFwdAlgoWinograd,<unused>;miopenConvolutionFwdAlgoGEMM:GemmFwdRest,0.096641,589824,miopenConvolutionFwdAlgoGEMM,<unused>
512-64-64-3x3-512-64-64-1-1x1-1x1-1x1-0-NCHW-FP32-F=miopenConvolutionFwdAlgoImplicitGEMM:ConvCkIgemmFwdV6r1DlopsNchw,6.26763,4096,miopenConvolutionFwdAlgoImplicitGEMM,<unused>;miopenConvolutionFwdAlgoDirect:ConvDirectNaiveConvFwd,278.423,0,miopenConvolutionFwdAlgoDirect,<unused>;miopenConvolutionFwdAlgoWinograd:ConvBinWinogradRxSf2x3g1,2.13165,0,miopenConvolutionFwdAlgoWinograd,<unused>;miopenConvolutionFwdAlgoGEMM:GemmFwdRest,4.88214,75497472,miopenConvolutionFwdAlgoGEMM,<unused>
512-64-64-1x1-512-64-64-1-0x0-1x1-1x1-0-NCHW-FP32-F=miopenConvolutionFwdAlgoImplicitGEMM:ConvCkIgemmFwdV6r1DlopsNchw,0.556122,4096,miopenConvolutionFwdAlgoImplicitGEMM,<unused>;miopenConvolutionFwdAlgoDirect:ConvDirectNaiveConvFwd,40.7742,0,miopenConvolutionFwdAlgoDirect,<unused>;miopenConvolutionFwdAlgoWinograd:ConvBinWinogradRxSf3x2,1.06724,0,miopenConvolutionFwdAlgoWinograd,<unused>;miopenConvolutionFwdAlgoGEMM:GemmFwd1x1_0_1,0.520743,0,miopenConvolutionFwdAlgoGEMM,<unused>
512-128-128-3x3-512-128-128-1-1x1-1x1-1x1-0-NCHW-FP32-F=miopenConvolutionFwdAlgoImplicitGEMM:ConvCkIgemmFwdV6r1DlopsNchw,23.6767,4096,miopenConvolutionFwdAlgoImplicitGEMM,<unused>;miopenConvolutionFwdAlgoDirect:ConvDirectNaiveConvFwd,1130.86,0,miopenConvolutionFwdAlgoDirect,<unused>;miopenConvolutionFwdAlgoWinograd:ConvBinWinogradRxSf2x3g1,8.72789,0,miopenConvolutionFwdAlgoWinograd,<unused>;miopenConvolutionFwdAlgoGEMM:GemmFwdRest,23.7705,301989888,miopenConvolutionFwdAlgoGEMM,<unused>
512-256-256-3x3-512-256-256-1-1x1-1x1-1x1-0-NCHW-FP32-F=miopenConvolutionFwdAlgoImplicitGEMM:ConvCkIgemmFwdV6r1DlopsNchw,95.4103,4096,miopenConvolutionFwdAlgoImplicitGEMM,<unused>;miopenConvolutionFwdAlgoDirect:ConvDirectNaiveConvFwd,4553.8,0,miopenConvolutionFwdAlgoDirect,<unused>;miopenConvolutionFwdAlgoWinograd:ConvBinWinogradRxSf3x2,60.3651,0,miopenConvolutionFwdAlgoWinograd,<unused>;miopenConvolutionFwdAlgoGEMM:GemmFwdRest,104.997,1207959552,miopenConvolutionFwdAlgoGEMM,<unused>
512-256-256-3x3-256-256-256-1-1x1-1x1-1x1-0-NCHW-FP32-F=miopenConvolutionFwdAlgoImplicitGEMM:ConvCkIgemmFwdV6r1DlopsNchw,48.7106,4096,miopenConvolutionFwdAlgoImplicitGEMM,<unused>;miopenConvolutionFwdAlgoDirect:ConvDirectNaiveConvFwd,2416.96,0,miopenConvolutionFwdAlgoDirect,<unused>;miopenConvolutionFwdAlgoWinograd:ConvBinWinogradRxSf3x2,30.0856,0,miopenConvolutionFwdAlgoWinograd,<unused>;miopenConvolutionFwdAlgoGEMM:GemmFwdRest,59.0181,1207959552,miopenConvolutionFwdAlgoGEMM,<unused>
512-256-256-1x1-256-256-256-1-0x0-1x1-1x1-0-NCHW-FP32-F=miopenConvolutionFwdAlgoImplicitGEMM:ConvCkIgemmFwdV6r1DlopsNchw,6.45299,4096,miopenConvolutionFwdAlgoImplicitGEMM,<unused>;miopenConvolutionFwdAlgoDirect:ConvDirectNaiveConvFwd,347.105,0,miopenConvolutionFwdAlgoDirect,<unused>;miopenConvolutionFwdAlgoWinograd:ConvBinWinogradRxSf3x2,16.592,0,miopenConvolutionFwdAlgoWinograd,<unused>;miopenConvolutionFwdAlgoGEMM:GemmFwd1x1_0_1,6.86505,0,miopenConvolutionFwdAlgoGEMM,<unused>
256-512-512-3x3-256-512-512-1-1x1-1x1-1x1-0-NCHW-FP32-F=miopenConvolutionFwdAlgoImplicitGEMM:ConvCkIgemmFwdV6r1DlopsNchw,94.9589,4096,miopenConvolutionFwdAlgoImplicitGEMM,<unused>;miopenConvolutionFwdAlgoDirect:ConvDirectNaiveConvFwd,4801.87,0,miopenConvolutionFwdAlgoDirect,<unused>;miopenConvolutionFwdAlgoWinograd:ConvBinWinogradRxSf3x2,61.1475,0,miopenConvolutionFwdAlgoWinograd,<unused>;miopenConvolutionFwdAlgoGEMM:GemmFwdRest,95.6858,2415919104,miopenConvolutionFwdAlgoGEMM,<unused>
256-512-512-3x3-128-512-512-1-1x1-1x1-1x1-0-NCHW-FP32-F=miopenConvolutionFwdAlgoImplicitGEMM:ConvCkIgemmFwdV6r1DlopsNchw,47.9336,4096,miopenConvolutionFwdAlgoImplicitGEMM,<unused>;miopenConvolutionFwdAlgoDirect:ConvDirectNaiveConvFwd,2680.64,0,miopenConvolutionFwdAlgoDirect,<unused>;miopenConvolutionFwdAlgoWinograd:ConvBinWinogradRxSf3x2,30.4258,0,miopenConvolutionFwdAlgoWinograd,<unused>;miopenConvolutionFwdAlgoGEMM:GemmFwdRest,54.4705,2415919104,miopenConvolutionFwdAlgoGEMM,<unused>
128-512-512-3x3-128-512-512-1-1x1-1x1-1x1-0-NCHW-FP32-F=miopenConvolutionFwdAlgoImplicitGEMM:ConvCkIgemmFwdV6r1DlopsNchw,24.0147,4096,miopenConvolutionFwdAlgoImplicitGEMM,<unused>;miopenConvolutionFwdAlgoDirect:ConvDirectNaiveConvFwd,1378.36,0,miopenConvolutionFwdAlgoDirect,<unused>;miopenConvolutionFwdAlgoWinograd:ConvBinWinogradRxSf2x3g1,11.0744,0,miopenConvolutionFwdAlgoWinograd,<unused>;miopenConvolutionFwdAlgoGEMM:GemmFwdRest,28.6621,1207959552,miopenConvolutionFwdAlgoGEMM,<unused>
256-512-512-1x1-128-512-512-1-0x0-1x1-1x1-0-NCHW-FP32-F=miopenConvolutionFwdAlgoImplicitGEMM:ConvCkIgemmFwdV6r1DlopsNchw,8.19603,4096,miopenConvolutionFwdAlgoImplicitGEMM,<unused>;miopenConvolutionFwdAlgoDirect:ConvDirectNaiveConvFwd,372.242,0,miopenConvolutionFwdAlgoDirect,<unused>;miopenConvolutionFwdAlgoWinograd:ConvBinWinogradRxSf3x2,14.6928,0,miopenConvolutionFwdAlgoWinograd,<unused>;miopenConvolutionFwdAlgoGEMM:GemmFwd1x1_0_1,7.77856,0,miopenConvolutionFwdAlgoGEMM,<unused>
128-512-512-3x3-3-512-512-1-1x1-1x1-1x1-0-NCHW-FP32-F=miopenConvolutionFwdAlgoDirect:ConvDirectNaiveConvFwd,279.313,0,miopenConvolutionFwdAlgoDirect,<unused>;miopenConvolutionFwdAlgoWinograd:ConvBinWinogradRxSf2x3g1,2.17657,0,miopenConvolutionFwdAlgoWinograd,<unused>;miopenConvolutionFwdAlgoGEMM:GemmFwdRest,22.6566,1207959552,miopenConvolutionFwdAlgoGEMM,<unused>
